{
  "authority_surfaces": {
    "current_state_projection": [
      "governance/projections/current_state.json"
    ],
    "current_state_projection_authority": [
      "docs/128_SLGE_SDLC_P0_DETERMINISTIC_LIFECYCLE_PROJECTION.md",
      "docs/14_PR_CHAIN_ROADMAP.md",
      "governance/projections/current_state.json",
      "governance/projections/slge_sdlc_current_lifecycle_state.json",
      "governance/registry/slge_sdlc_p0_lifecycle_events.json",
      "schemas/governance/slge_sdlc_current_lifecycle_state.schema.json",
      "schemas/governance/slge_sdlc_p0_lifecycle_events.schema.json",
      "src/taaqqul_slot_geometry/governance/repo_org_projection.py",
      "src/taaqqul_slot_geometry/governance/slge_sdlc_p0_projection.py",
      "tests/test_repo_org_governance_projection.py",
      "tests/test_slge_sdlc_p0_projection.py"
    ],
    "evidence_authority": [
      ".github/workflows/ci.yml",
      "docs/115_V1_CLOSURE_FREEZE_BOUNDARY_LAW.md",
      "docs/116_V1_CLOSURE_EVIDENCE_LEDGER.md",
      "docs/122_SIGNIFICATION_IDENTITY_AND_REPRESENTATION_PREREQUISITE_LAW.md",
      "docs/124_SLOT_LICENSED_GEOMETRICAL_ENGINEERING_PROJECT_DEVELOPMENT_LIFECYCLE_CONSTITUTION.md",
      "docs/125_SLGE_SDLC_R0_MACHINE_CONTRACTS.md",
      "docs/126_SLGE_SDLC_M0_LEGACY_REMAP_CONTRACT.md",
      "docs/127_SLGE_SDLC_E0_LIFECYCLE_EXECUTION_ENGINE.md",
      "docs/128_SLGE_SDLC_P0_DETERMINISTIC_LIFECYCLE_PROJECTION.md",
      "docs/129_SLGE_SDLC_G0_REPOSITORY_AND_PR_ENFORCEMENT.md",
      "docs/14_PR_CHAIN_ROADMAP.md",
      "governance/projections/current_state.json",
      "governance/projections/slge_sdlc_current_lifecycle_state.json",
      "governance/registry",
      "governance/registry/slge_sdlc_e0_runtime.json",
      "governance/registry/slge_sdlc_g0_runtime.json",
      "governance/registry/slge_sdlc_m0_legacy_remap.json",
      "governance/registry/slge_sdlc_p0_lifecycle_events.json",
      "governance/registry/slge_sdlc_r0_contracts.json",
      "schemas/governance/registry.schema.json",
      "schemas/governance/slge_sdlc_current_lifecycle_state.schema.json",
      "schemas/governance/slge_sdlc_e0_runtime.schema.json",
      "schemas/governance/slge_sdlc_g0_runtime.schema.json",
      "schemas/governance/slge_sdlc_m0_legacy_remap.schema.json",
      "schemas/governance/slge_sdlc_p0_lifecycle_events.schema.json",
      "schemas/governance/slge_sdlc_r0_contracts.schema.json",
      "src/taaqqul_slot_geometry",
      "src/taaqqul_slot_geometry/__init__.py",
      "src/taaqqul_slot_geometry/governance/repo_org_projection.py",
      "src/taaqqul_slot_geometry/governance/slge_sdlc_e0_runtime.py",
      "src/taaqqul_slot_geometry/governance/slge_sdlc_g0_enforcement.py",
      "src/taaqqul_slot_geometry/governance/slge_sdlc_p0_projection.py",
      "tests",
      "tests/test_repo_org_governance_projection.py",
      "tests/test_slge_sdlc_e0_runtime.py",
      "tests/test_slge_sdlc_g0_runtime.py",
      "tests/test_slge_sdlc_m0_legacy_remap.py",
      "tests/test_slge_sdlc_p0_projection.py",
      "tests/test_slge_sdlc_r0_machine_contracts.py"
    ],
    "historical_authority": [
      "CLAUDE.md",
      "docs/116_V1_CLOSURE_EVIDENCE_LEDGER.md",
      "docs/14_PR_CHAIN_ROADMAP.md",
      "docs/README.md",
      "governance/history/amendments.jsonl",
      "governance/projections/current_state.json"
    ],
    "law_authority": [
      "docs/115_V1_CLOSURE_FREEZE_BOUNDARY_LAW.md",
      "docs/116_V1_CLOSURE_EVIDENCE_LEDGER.md",
      "docs/119_GENERAL_ALGEBRA_OBSERVATORY_FOUNDATION_LAW.md",
      "docs/120_EPISTEMIC_SELF_STATE_DERIVATION_LAW.md",
      "docs/121_GENERAL_HYPOTHESIS_REGISTRY_LAW.md",
      "docs/122_SIGNIFICATION_IDENTITY_AND_REPRESENTATION_PREREQUISITE_LAW.md",
      "docs/123_REPOSITORY_STATE_AUTHORITY_AND_TOPOLOGY_LAW.md",
      "docs/124_SLOT_LICENSED_GEOMETRICAL_ENGINEERING_PROJECT_DEVELOPMENT_LIFECYCLE_CONSTITUTION.md",
      "docs/14_PR_CHAIN_ROADMAP.md",
      "governance/projections/current_state.json"
    ],
    "projection_contract_authority": [
      "README.md",
      "docs/120_EPISTEMIC_SELF_STATE_DERIVATION_LAW.md",
      "docs/123_REPOSITORY_STATE_AUTHORITY_AND_TOPOLOGY_LAW.md",
      "docs/124_SLOT_LICENSED_GEOMETRICAL_ENGINEERING_PROJECT_DEVELOPMENT_LIFECYCLE_CONSTITUTION.md",
      "docs/125_SLGE_SDLC_R0_MACHINE_CONTRACTS.md",
      "docs/126_SLGE_SDLC_M0_LEGACY_REMAP_CONTRACT.md",
      "docs/127_SLGE_SDLC_E0_LIFECYCLE_EXECUTION_ENGINE.md",
      "docs/128_SLGE_SDLC_P0_DETERMINISTIC_LIFECYCLE_PROJECTION.md",
      "docs/14_PR_CHAIN_ROADMAP.md",
      "docs/README.md",
      "governance/projections/current_state.json",
      "governance/registry",
      "governance/registry/data_taxonomy.json",
      "governance/registry/schema_taxonomy.json",
      "governance/registry/slge_sdlc_m0_legacy_remap.json",
      "governance/registry/slge_sdlc_r0_contracts.json",
      "schemas/governance/registry.schema.json",
      "schemas/governance/slge_sdlc_m0_legacy_remap.schema.json",
      "schemas/governance/slge_sdlc_r0_contracts.schema.json",
      "tests/test_slge_sdlc_m0_legacy_remap.py",
      "tests/test_slge_sdlc_r0_machine_contracts.py"
    ],
    "projection_runtime_authority": [
      "docs/127_SLGE_SDLC_E0_LIFECYCLE_EXECUTION_ENGINE.md",
      "docs/128_SLGE_SDLC_P0_DETERMINISTIC_LIFECYCLE_PROJECTION.md",
      "docs/14_PR_CHAIN_ROADMAP.md",
      "governance/projections/current_state.json",
      "governance/projections/slge_sdlc_current_lifecycle_state.json",
      "governance/registry/slge_sdlc_e0_runtime.json",
      "governance/registry/slge_sdlc_p0_lifecycle_events.json",
      "schemas/governance/slge_sdlc_current_lifecycle_state.schema.json",
      "schemas/governance/slge_sdlc_e0_runtime.schema.json",
      "schemas/governance/slge_sdlc_p0_lifecycle_events.schema.json",
      "src/taaqqul_slot_geometry/governance/repo_org_projection.py",
      "src/taaqqul_slot_geometry/governance/slge_sdlc_e0_runtime.py",
      "src/taaqqul_slot_geometry/governance/slge_sdlc_p0_projection.py",
      "tests/test_repo_org_governance_projection.py",
      "tests/test_slge_sdlc_e0_runtime.py",
      "tests/test_slge_sdlc_p0_projection.py"
    ],
    "runtime_authority": [
      "docs/129_SLGE_SDLC_G0_REPOSITORY_AND_PR_ENFORCEMENT.md",
      "docs/14_PR_CHAIN_ROADMAP.md",
      "governance/registry/slge_sdlc_g0_runtime.json",
      "src/taaqqul_slot_geometry",
      "src/taaqqul_slot_geometry/governance/slge_sdlc_g0_enforcement.py",
      "tests",
      "tests/test_slge_sdlc_g0_runtime.py"
    ]
  },
  "derived_from": {
    "history": "governance/history/amendments.jsonl",
    "registry": [
      "governance/registry/artifacts.json",
      "governance/registry/branches.json",
      "governance/registry/dependencies.json",
      "governance/registry/runtime_map.json",
      "governance/registry/evidence_map.json",
      "governance/registry/residuals.json",
      "governance/registry/projection_inputs.json",
      "governance/registry/slge_sdlc_r0_contracts.json",
      "governance/registry/slge_sdlc_m0_legacy_remap.json",
      "governance/registry/slge_sdlc_e0_runtime.json",
      "governance/registry/slge_sdlc_p0_lifecycle_events.json",
      "governance/projections/slge_sdlc_current_lifecycle_state.json"
    ]
  },
  "highlights": {
    "gua_pilot_domains": {
      "identifier": "GUA1PilotDomainSet",
      "note": "Pilot set for GUA-1 proof surface; not a universal domain ontology.",
      "values": [
        "language",
        "mathematics",
        "physics",
        "programming"
      ]
    },
    "observatory_program": {
      "authority_impact": "NONE_ON_V1_CLOSURE",
      "does_not_imply": "V1_CLOSED",
      "scope": "POST_V1_RESEARCH"
    },
    "v1_closure": {
      "note": "Evidence ledger row must show objective as PROVEN to claim V1 closure.",
      "objective_v1_44": "REFUSED",
      "source": "docs/116_V1_CLOSURE_EVIDENCE_LEDGER.md"
    }
  },
  "projection_id": "REPO_STATE_SHA256_049ec73381372e73",
  "projection_metadata": {
    "authoritative_inputs": [
      "governance/history/amendments.jsonl",
      "governance/registry/artifacts.json",
      "governance/registry/branches.json",
      "governance/registry/dependencies.json",
      "governance/registry/runtime_map.json",
      "governance/registry/evidence_map.json",
      "governance/registry/residuals.json",
      "governance/registry/projection_inputs.json",
      "governance/registry/slge_sdlc_r0_contracts.json",
      "governance/registry/slge_sdlc_m0_legacy_remap.json",
      "governance/registry/slge_sdlc_e0_runtime.json",
      "governance/registry/slge_sdlc_p0_lifecycle_events.json",
      "governance/projections/slge_sdlc_current_lifecycle_state.json"
    ],
    "projection_schema_version": "2.0.0",
    "projector_algorithm_id": "REPO-ORG-P0.v1",
    "reduction_contract": [
      "StateIsProjection",
      "HistoryAndTypedRecordsAreAuthority",
      "NarrativeViewsAreNotAuthority",
      "NoComputedStateWithoutReconstructibleProvenance"
    ],
    "source_fingerprints": {
      "governance/history/amendments.jsonl": "18c92e511ad98480770809a2f40ac37abd0cd7761a47101eff428e7fce6e1638",
      "governance/projections/slge_sdlc_current_lifecycle_state.json": "b51f8297c32bde3739fc4219485b6a04c2404a5b78dcca29d4c9282a12611522",
      "governance/registry/artifacts.json": "711eb795919b2315fa882756db40dbfe18bf54c73d213915c92c0a993827d8a1",
      "governance/registry/branches.json": "1114aba76b902690428159e2bbb853fb506ffec82b8e39fcdd71770910920d74",
      "governance/registry/dependencies.json": "bf29fb1a10ad03bdd5310b8500040c88bbc058b3fd3dae76508b7579fab5f84f",
      "governance/registry/evidence_map.json": "365ea821c731eed73d5103ca46b3177175cdb0447b96e7fd1e7d10e2bc5b42be",
      "governance/registry/projection_inputs.json": "aae0a07105e253a4dfd568c38b46fb1676d29f5aa2eec7f28bfa409bd8995c6c",
      "governance/registry/residuals.json": "7c717daf696f3b1d4a876ac90b0f17fc32a0241004566b950a0eff4a94369497",